{
  "$schema": "https://json-schema.org/draft/2020-12/schema",
  "$id": "https://open-kinematics.dev/contracts/multibody_case_v1.json",
  "title": "Multibody Case Contract V1",
  "description": "Declarative case definition. The case layer expands grids, load paths, side modes and excitations itself, and the expanded identity is reported back in the result manifest. A time-history family that runs one excitation per case may instead declare a top-level `runs` array: each entry names one run and overrides only the fields that family reads for it (its payload tables, its road, its own section), while the time grid, the solver and the outputs stay shared because the kernel runs every case on one grid. Family-specific requirements beyond the structural rules below are enforced by the case layer.",
  "type": "object",
  "additionalProperties": false,
  "required": ["contract", "contract_version", "kind", "family", "name"],
  "properties": {
    "contract": {"const": "multibody-case"},
    "contract_version": {"const": 1},
    "kind": {"const": "case"},
    "family": {
      "enum": [
        "kc_quasi_static", "axle_dynamic", "vehicle_kc", "vehicle_dynamic",
        "handling", "ride_four_post", "ride_random_road", "comparison"
      ]
    },
    "name": {"type": "string", "minLength": 1},
    "description": {"type": "string"},
    "drive_mode": {
      "description": "How the case decides the assembly's pose. 'kinematics' solves the constraint equations alone, with no force element or tire in the residual. 'force_balance' additionally balances the elastic elements (springs, dampers, anti-roll bars, bushings, bump stops) against the driven targets, and is the default. 'pad' drives a ground height instead of the wheel centre, so the tires carry the wheel and the ground is what is swept.",
      "enum": ["kinematics", "force_balance", "pad"]
    },
    "solver": {
      "type": "object",
      "additionalProperties": false,
      "properties": {
        "integrator": {"enum": ["ggl_generalized_alpha", "hht"]},
        "rho_inf": {"type": "number", "minimum": 0},
        "hht_alpha": {"type": "number"},
        "initialization_mode": {"enum": ["static_equilibrium", "provided_consistent_state"]},
        "adaptive_step": {"type": "boolean"},
        "internal_step_s": {"type": "number", "minimum": 0},
        "minimum_step_s": {"type": "number", "minimum": 0},
        "maximum_step_s": {"type": "number", "minimum": 0},
        "local_relative_tolerance": {"type": "number", "minimum": 0},
        "local_position_tolerance_m": {"type": "number", "minimum": 0},
        "local_angle_tolerance_rad": {"type": "number", "minimum": 0},
        "local_velocity_tolerance_m_per_s": {"type": "number", "minimum": 0},
        "local_angular_velocity_tolerance_rad_per_s": {"type": "number", "minimum": 0},
        "local_brush_tolerance_m": {"type": "number", "minimum": 0},
        "contact_event_tolerance_s": {"type": "number", "minimum": 0},
        "max_newton_iterations": {"type": "integer", "minimum": 1},
        "max_line_search_iterations": {"type": "integer", "minimum": 1},
        "position_tolerance_m": {"type": "number", "minimum": 0},
        "velocity_tolerance_m_per_s": {"type": "number", "minimum": 0},
        "dynamics_tolerance": {"type": "number", "minimum": 0},
        "increment_tolerance": {"type": "number", "minimum": 0}
      }
    },
    "k": {
      "type": "object",
      "additionalProperties": false,
      "properties": {
        "wheel_values_mm": {"type": "array", "items": {"type": "number"}},
        "axes": {
          "description": "A general driven-coordinate grid: one entry per driven coordinate, each with the values it takes, expanded as a cartesian product with the last axis varying fastest. The shorthand (wheel_values_mm + rack_values_mm + axis_map) is the equivalent form for an axle sweep.",
          "type": "array",
          "minItems": 1,
          "items": {
            "type": "object",
            "additionalProperties": false,
            "required": ["coordinate", "values_mm"],
            "properties": {
              "coordinate": {"type": "string", "minLength": 1},
              "values_mm": {
                "type": "array",
                "minItems": 1,
                "items": {"type": "number"}
              }
            }
          }
        },
        "ramp_s": {"type": "number", "minimum": 0},
        "body_wrench": {
          "description": "Constant wrenches applied to named bodies for the whole K run -- forces in N, moments in N*mm. One wrench per body rather than a per-sample table: a K state is a kinematic solution.",
          "type": "array",
          "items": {
            "type": "object",
            "additionalProperties": false,
            "required": ["body", "wrench"],
            "properties": {
              "body": {"type": "string", "minLength": 1},
              "wrench": {
                "type": "array",
                "items": {"type": "number"},
                "minItems": 6,
                "maxItems": 6
              }
            }
          }
        },
        "rack_values_mm": {"type": "array", "items": {"type": "number"}},
        "pad_height_mm": {
          "description": "The ground heights to sweep, in millimetres, for drive_mode 'pad'. One expansion entry per height, each solved as its own equilibrium: the pad is a surface the wheel is measured against, not a driven coordinate, so it cannot be expressed through axis_map. A plane road's origin_z carries the height.",
          "type": "array",
          "minItems": 1,
          "items": {"type": "number"}
        },
        "drive": {"enum": ["wheel_center", "contact_point"]},
        "left_right_mode": {"enum": ["single", "symmetric", "opposite"]},
        "axis_map": {
          "type": "object",
          "additionalProperties": false,
          "properties": {
            "wheel": {"type": "array", "items": {"type": "string"}},
            "rack": {"type": "string"}
          }
        }
      }
    },
    "c": {
      "type": "object",
      "additionalProperties": false,
      "properties": {
        "paths": {"type": "array", "items": {"type": "string"}},
        "levels": {"type": "integer", "minimum": 3},
        "maximum": {"type": "number"},
        "side_mode": {"enum": ["single", "symmetric", "opposite"]},
        "mirror_marker": {
          "description": "The marker the other side's load is applied at; required when side_mode is not single.",
          "type": "string",
          "minLength": 1
        },
        "loads": {
          "description": "Explicit six-component loads -- forces in N, moments in N*mm -- as an alternative to the paths/levels/maximum sweep.",
          "type": "array",
          "minItems": 1,
          "items": {
            "type": "object",
            "additionalProperties": false,
            "properties": {
              "fx": {"type": "number"},
              "fy": {"type": "number"},
              "fz": {"type": "number"},
              "mx": {"type": "number"},
              "my": {"type": "number"},
              "mz": {"type": "number"}
            }
          }
        },
        "load_marker": {"type": "string"}
      }
    },
    "time": {
      "type": "object",
      "additionalProperties": false,
      "properties": {
        "samples": {"type": "string", "minLength": 1},
        "start_s": {"type": "number"},
        "end_s": {"type": "number"},
        "step_s": {"type": "number"},
        "output_step_s": {"type": "number"}
      }
    },
    "inputs": {"type": "object"},
    "outputs": {
      "type": "object",
      "additionalProperties": false,
      "properties": {
        "constraint_reaction": {"type": "boolean"},
        "constraint_jacobian": {"type": "boolean"},
        "element_wrench": {"type": "boolean"},
        "accepted_state": {"type": "boolean"}
      }
    },
    "vehicle": {"type": "object"},
    "four_post": {"type": "object"},
    "handling": {"type": "object"},
    "ride_random_road": {"type": "object"},
    "comparison": {
      "type": "object",
      "additionalProperties": false,
      "properties": {
        "reference": {"type": "string"},
        "channels": {"type": "array", "items": {"type": "string"}},
        "tolerance": {"type": "object"}
      }
    },
    "blobs": {"type": "array", "items": {"type": "object"}},
    "characteristics": {
      "type": "object",
      "additionalProperties": false,
      "required": ["schema_version", "characteristics"],
      "properties": {
        "schema_version": {"const": 1},
        "characteristics": {"type": "object"}
      }
    },
    "runs": {
      "description": "One entry per run, for a time-history family that runs one excitation per case. Each entry names its run and overrides only the fields that family reads for the run: its payload tables, its road, its own section, and the two case-level overrides under inputs. The document keeps the time grid, the solver, the outputs and the characteristics request because the kernel runs every case of one document on one grid with one solver, and a run may not restate them. Every entry override merges with the document: blobs merge by name (a run of the same name replaces the document's table), inputs merge one level deep, and any other key replaces. Family-specific acceptance of a key is enforced by the case layer.",
      "type": "array",
      "minItems": 1,
      "items": {"$ref": "#/$defs/run"}
    }
  },
  "$defs": {
    "run": {
      "description": "One named run of a document that declares a runs list. The union of the keys the time-history families read is listed here; a family refuses a key it does not read, so an override cannot be silently ignored.",
      "type": "object",
      "additionalProperties": false,
      "required": ["name"],
      "properties": {
        "name": {"type": "string", "minLength": 1},
        "blobs": {"type": "array", "items": {"type": "object"}},
        "inputs": {"type": "object"},
        "road": {"type": "object"},
        "handling": {"type": "object"},
        "four_post": {"type": "object"},
        "ride_random_road": {"type": "object"}
      }
    }
  }
}
